{
  "schemaVersion": "1.0.0",
  "bundleId": "bundle-passing-demo",
  "subject": {
    "kind": "agent",
    "agentId": "agentplane",
    "displayName": "agentplane",
    "harness": "codex-cli",
    "model": "gpt-5",
    "operator": {
      "kind": "human",
      "id": "densmirnov",
      "displayName": "Denis Smirnov"
    }
  },
  "context": {
    "project": {
      "name": "agentplane Attestations",
      "theme": "Agents that trust",
      "problem": "Humans and downstream agents need a portable way to decide whether agent output is trustworthy."
    },
    "task": {
      "id": "202603130958-JRS5E8",
      "title": "Build agentplane Attestations MVP"
    },
    "source": {
      "repo": "synthesis-hackathon",
      "branch": "main",
      "commit": "demo-local-passing"
    }
  },
  "artifacts": [
    {
      "artifactId": "intent-1",
      "kind": "intent",
      "generatedAt": "2026-03-13T10:01:00.000Z",
      "producer": {
        "kind": "agent",
        "id": "agentplane",
        "displayName": "agentplane"
      },
      "subjectRef": {
        "kind": "task",
        "id": "202603130958-JRS5E8"
      },
      "mediaType": "application/json",
      "payload": {
        "summary": "Generate a portable attestation, verify it under explicit policy, and render a demo report.",
        "scope": [
          "schema",
          "verification",
          "demo-report"
        ],
        "requestedOutcome": "Produce a trust-aware attestation MVP."
      }
    },
    {
      "artifactId": "approval-1",
      "kind": "approval",
      "generatedAt": "2026-03-13T10:02:00.000Z",
      "producer": {
        "kind": "human",
        "id": "densmirnov",
        "displayName": "Denis Smirnov"
      },
      "subjectRef": {
        "kind": "task",
        "id": "202603130958-JRS5E8"
      },
      "mediaType": "application/json",
      "payload": {
        "status": "approved",
        "rationale": "Scope and demo path are acceptable."
      }
    },
    {
      "artifactId": "execution-1",
      "kind": "execution",
      "generatedAt": "2026-03-13T10:30:00.000Z",
      "producer": {
        "kind": "agent",
        "id": "agentplane",
        "displayName": "agentplane"
      },
      "subjectRef": {
        "kind": "task",
        "id": "202603130958-JRS5E8"
      },
      "mediaType": "application/json",
      "payload": {
        "repo": "synthesis-hackathon",
        "branch": "main",
        "commit": "demo-local-passing",
        "filesChanged": [
          "README.md",
          "package.json",
          "src/cli.mjs",
          "src/lib/attestation.mjs",
          "src/lib/policy.mjs",
          "src/lib/report.mjs",
          "tests/attestation.test.mjs"
        ],
        "diffStat": {
          "added": 640,
          "deleted": 0
        }
      }
    },
    {
      "artifactId": "verification-1",
      "kind": "verification",
      "generatedAt": "2026-03-13T10:33:00.000Z",
      "producer": {
        "kind": "ci",
        "id": "local-node-test",
        "displayName": "local-node-test"
      },
      "subjectRef": {
        "kind": "task",
        "id": "202603130958-JRS5E8"
      },
      "mediaType": "application/json",
      "payload": {
        "conversationLogAttached": true,
        "checks": [
          {
            "name": "Generate passing attestation",
            "required": true,
            "status": "pass"
          },
          {
            "name": "Verify passing attestation",
            "required": true,
            "status": "pass"
          },
          {
            "name": "Render passing report",
            "required": false,
            "status": "pass"
          }
        ]
      }
    },
    {
      "artifactId": "conversation-1",
      "kind": "conversation",
      "generatedAt": "2026-03-13T10:33:30.000Z",
      "producer": {
        "kind": "system",
        "id": "agentplane",
        "displayName": "agentplane"
      },
      "subjectRef": {
        "kind": "task",
        "id": "202603130958-JRS5E8"
      },
      "mediaType": "application/json",
      "payload": {
        "attached": true,
        "summary": "Conversation log is available in task history."
      }
    },
    {
      "artifactId": "anchor-1",
      "kind": "anchor",
      "generatedAt": "2026-03-13T10:34:00.000Z",
      "producer": {
        "kind": "chain",
        "id": "base-mainnet",
        "displayName": "Base Mainnet"
      },
      "subjectRef": {
        "kind": "agent",
        "id": "agentplane"
      },
      "mediaType": "application/json",
      "payload": {
        "kind": "hackathon-registration",
        "chain": "Base",
        "txUrl": "https://basescan.org/tx/0x2f06bc4d286d50e20aa55e4fc6bdb762c20cf219298be55aa688955c53e4230e"
      }
    },
    {
      "artifactId": "note-1",
      "kind": "note",
      "generatedAt": "2026-03-13T10:35:00.000Z",
      "producer": {
        "kind": "agent",
        "id": "agentplane",
        "displayName": "agentplane"
      },
      "subjectRef": {
        "kind": "task",
        "id": "202603130958-JRS5E8"
      },
      "mediaType": "text/plain",
      "payload": {
        "text": "This sample represents the green path for the hackathon demo."
      }
    }
  ]
}
